{
  "v": 1,
  "generato": "2026-09-05",
  "sorgente": "S3",
  "simboli": [
    {
      "rif": "0.1",
      "fonte": "S3",
      "sezione": "colonna-c",
      "nome": "Più a nord",
      "descrizione": "Di due oggetti simili il più a nord oppure il più a nord di tanti oggetti simili.",
      "colonna": "C",
      "direzioni": [
        "N",
        "E",
        "S",
        "W"
      ],
      "pagina": 7,
      "artwork": {
        "path": "content/artwork/descrizioni-punti/0.1N.svg",
        "formato": "svg",
        "origine": "S4",
        "sha256": "0d9ed02553f52e2b23e15a14022c36319dc400511f91d776648c4ba6b5ef01be"
      }
    },
    {
      "rif": "0.2",
      "fonte": "S3",
      "sezione": "colonna-c",
      "nome": "Più a sud-est",
      "descrizione": "Di due oggetti simili il più a sud-est oppure il più a sud-est di tanti oggetti simili.",
      "colonna": "C",
      "direzioni": [
        "NE",
        "SE",
        "SW",
        "NW"
      ],
      "pagina": 7,
      "artwork": {
        "path": "content/artwork/descrizioni-punti/0.2NE.svg",
        "formato": "svg",
        "origine": "S4",
        "sha256": "6c9ef5f158b7c97275de155d7db6d7abedba4d246e12b618039166354f40db0f"
      }
    },
    {
      "rif": "0.3",
      "fonte": "S3",
      "sezione": "colonna-c",
      "nome": "superiore",
      "descrizione": "Quando l’oggetto del punto è direttamente sopra un oggetto simile.",
      "colonna": "C",
      "pagina": 7,
      "artwork": {
        "path": "content/artwork/descrizioni-punti/0.3.svg",
        "formato": "svg",
        "origine": "S4",
        "sha256": "eb5267cea7816d0838d30e99667c9155b99455b1eb0aab166a26e1824aa15f89"
      }
    },
    {
      "rif": "0.4",
      "fonte": "S3",
      "sezione": "colonna-c",
      "nome": "inferiore",
      "descrizione": "Quando l’oggetto del punto è direttamente sotto un oggetto simile.",
      "colonna": "C",
      "pagina": 7,
      "artwork": {
        "path": "content/artwork/descrizioni-punti/0.4.svg",
        "formato": "svg",
        "origine": "S4",
        "sha256": "970eb3fb10cbda640074b68e12fa82bd1a9d65eb02b3f80b1a01319318293e63"
      }
    },
    {
      "rif": "0.5",
      "fonte": "S3",
      "sezione": "colonna-c",
      "nome": "centrale",
      "descrizione": "Quando l’oggetto del punto è quello centrale rispetto ad altri oggetti simili.",
      "colonna": "C",
      "pagina": 7,
      "artwork": {
        "path": "content/artwork/descrizioni-punti/0.5.svg",
        "formato": "svg",
        "origine": "S4",
        "sha256": "971632bde875dc3da6f5f866120c19c0fbae60aa61b7717f905c2377d4460385"
      }
    },
    {
      "rif": "1.1",
      "fonte": "S3",
      "sezione": "d-morfologici",
      "nome": "Terrazzo",
      "descrizione": "Ripiano in un pendio.",
      "colonna": "D",
      "famiglia": "Oggetti morfologici",
      "pagina": 7,
      "artwork": {
        "path": "content/artwork/descrizioni-punti/1.1.svg",
        "formato": "svg",
        "origine": "S4",
        "sha256": "2ba61c74c89fc3dafc3f16cd6d1cdc7408336131eac955cfb1288a1f7bc3f377"
      }
    },
    {
      "rif": "1.2",
      "fonte": "S3",
      "sezione": "d-morfologici",
      "nome": "Naso",
      "descrizione": "Piccola sporgenza del terreno su un pendio.",
      "colonna": "D",
      "famiglia": "Oggetti morfologici",
      "pagina": 7,
      "artwork": {
        "path": "content/artwork/descrizioni-punti/1.2.svg",
        "formato": "svg",
        "origine": "S4",
        "sha256": "e56b1ded52d7e6a71135b6c233e2b9450ffcb5cd7f1c1ca3ab12d64a196702bc"
      }
    },
    {
      "rif": "1.3",
      "fonte": "S3",
      "sezione": "d-morfologici",
      "nome": "Rientranza",
      "descrizione": "Insenatura del terreno su un pendio, valletta, il contrario di un naso.",
      "colonna": "D",
      "famiglia": "Oggetti morfologici",
      "pagina": 7,
      "artwork": {
        "path": "content/artwork/descrizioni-punti/1.3.svg",
        "formato": "svg",
        "origine": "S4",
        "sha256": "03d1750acb5b46a73ff579fdea44e71b11ea11f99597aec181f30ba9e346cdf1"
      }
    },
    {
      "rif": "1.4",
      "fonte": "S3",
      "sezione": "d-morfologici",
      "nome": "Scarpata ripida",
      "descrizione": "Superficie di terreno più ripida del terreno circostante, chiaramente identificabile.",
      "colonna": "D",
      "famiglia": "Oggetti morfologici",
      "pagina": 7,
      "artwork": {
        "path": "content/artwork/descrizioni-punti/1.4.svg",
        "formato": "svg",
        "origine": "S4",
        "sha256": "9796686736035bd98dce844dbfaddec9cfb2e1d24ba7ee0f1c0b9c022fafe973"
      },
      "isom": [
        "106"
      ]
    },
    {
      "rif": "1.5",
      "fonte": "S3",
      "sezione": "d-morfologici",
      "nome": "Cava",
      "descrizione": "Luogo di estrazione di sabbia o pietre, situato su terreno pianeggiante o su un pendio.",
      "colonna": "D",
      "famiglia": "Oggetti morfologici",
      "pagina": 7,
      "artwork": {
        "path": "content/artwork/descrizioni-punti/1.5.svg",
        "formato": "svg",
        "origine": "S4",
        "sha256": "8aa3a2135c3cb03ee480705133ebcf45653f9473cf26d531337e2c0356dd51a4"
      },
      "isom": [
        "106"
      ]
    },
    {
      "rif": "1.6",
      "fonte": "S3",
      "sezione": "d-morfologici",
      "nome": "Muro di terra",
      "descrizione": "Muro di terra emergente dal terreno circostante; può essere parzialmente sassoso, di solito artificiale. Usato con il simbolo 8.11 per indicare un muro di terra rovinato.",
      "colonna": "D",
      "famiglia": "Oggetti morfologici",
      "pagina": 7,
      "artwork": {
        "path": "content/artwork/descrizioni-punti/1.6.svg",
        "formato": "svg",
        "origine": "S4",
        "sha256": "dd98ec59a08b37ebf756b838866f935060bc00790a1e51bb0a82515b3a147a0e"
      },
      "isom": [
        "107",
        "108"
      ]
    },
    {
      "rif": "1.7",
      "fonte": "S3",
      "sezione": "d-morfologici",
      "nome": "Fossa",
      "descrizione": "Una fossa creata dall’erosione oppure un fossato, normalmente asciutto/secco.",
      "colonna": "D",
      "famiglia": "Oggetti morfologici",
      "pagina": 7,
      "artwork": {
        "path": "content/artwork/descrizioni-punti/1.7.svg",
        "formato": "svg",
        "origine": "S4",
        "sha256": "14bf9d1362e59469bef714d0ac107687ef2daa9206d51d036caf2f0070e6e68f"
      },
      "isom": [
        "109"
      ]
    },
    {
      "rif": "1.8",
      "fonte": "S3",
      "sezione": "d-morfologici",
      "nome": "Piccola fossa",
      "descrizione": "Una piccola fossa creata dall’erosione oppure un piccolo fossato, normalmente asciutto/secco.",
      "colonna": "D",
      "famiglia": "Oggetti morfologici",
      "pagina": 7,
      "artwork": {
        "path": "content/artwork/descrizioni-punti/1.8.svg",
        "formato": "svg",
        "origine": "S4",
        "sha256": "437643f7d202f44aff05db79c89f16a7d86a3359cb6980f9ccd4a7a9c2a90842"
      },
      "isom": [
        "110"
      ]
    },
    {
      "rif": "1.9",
      "fonte": "S3",
      "sezione": "d-morfologici",
      "nome": "Collina",
      "descrizione": "Rilievo, rappresentato sulla carta mediante curve di livello.",
      "colonna": "D",
      "famiglia": "Oggetti morfologici",
      "pagina": 7,
      "artwork": {
        "path": "content/artwork/descrizioni-punti/1.9.svg",
        "formato": "svg",
        "origine": "S4",
        "sha256": "5e7c61c7064160376f7b25344c62d0f65fd85a6fab55db6c57966548d1de42c5"
      },
      "isom": [
        "101",
        "111"
      ]
    },
    {
      "rif": "1.10",
      "fonte": "S3",
      "sezione": "d-morfologici",
      "nome": "Collinetta",
      "descrizione": "Piccolo rilievo ben visibile. Usato con il simbolo 8.6 per indicare una collinetta rocciosa.",
      "colonna": "D",
      "famiglia": "Oggetti morfologici",
      "pagina": 7,
      "artwork": {
        "path": "content/artwork/descrizioni-punti/1.10.svg",
        "formato": "svg",
        "origine": "S4",
        "sha256": "627d8bada82aa1c7242b1ab441f597cb2d7a2e6c8c3c8cece267adb46293cf5c"
      },
      "isom": [
        "112",
        "113"
      ]
    },
    {
      "rif": "1.11",
      "fonte": "S3",
      "sezione": "d-morfologici",
      "nome": "Sella",
      "descrizione": "Luogo più basso tra due punti più elevati.",
      "colonna": "D",
      "famiglia": "Oggetti morfologici",
      "pagina": 8,
      "artwork": {
        "path": "content/artwork/descrizioni-punti/1.11.svg",
        "formato": "svg",
        "origine": "S4",
        "sha256": "d131eb37f2331807d846f6d4f09b16417f9f8c49567201fd56f77b7095964691"
      }
    },
    {
      "rif": "1.12",
      "fonte": "S3",
      "sezione": "d-morfologici",
      "nome": "Depressione",
      "descrizione": "Depressione o buca da cui il suolo si rialza su tutti i lati. Rappresentato sulla carta mediante curve di livello.",
      "colonna": "D",
      "famiglia": "Oggetti morfologici",
      "pagina": 8,
      "artwork": {
        "path": "content/artwork/descrizioni-punti/1.12.svg",
        "formato": "svg",
        "origine": "S4",
        "sha256": "580a10277c76f5b82eb299028229e3b289c2abeeadb054515a11717b7093abf8"
      }
    },
    {
      "rif": "1.13",
      "fonte": "S3",
      "sezione": "d-morfologici",
      "nome": "Buca",
      "descrizione": "Piccola, poco profonda depressione o buca naturale da cui il suolo si rialza su tutti i lati.",
      "colonna": "D",
      "famiglia": "Oggetti morfologici",
      "pagina": 8,
      "artwork": {
        "path": "content/artwork/descrizioni-punti/1.13.svg",
        "formato": "svg",
        "origine": "S4",
        "sha256": "11b04f5fb6147b57dbf4ebc955c84af4bfa53842764b4faa9e39002a23faa9af"
      }
    },
    {
      "rif": "1.14",
      "fonte": "S3",
      "sezione": "d-morfologici",
      "nome": "Buca profonda",